{
    "$schema": "../../../../schema/jsonforjwt.json",
    "sender": {
        "address": "0192:311780735"
    },
    "receiver": {
        "address": "0192:314240979"
    },
    "metadata": {
        "encryption": "AES256",
        "securityLevel": 4
    },
    "asicEntryPoint": "manifest.xml",
    "maskinportenToken": "1223",
    "documentPackageFingerprint": {
        "digestMethod": "http://www.w3.org/2001/04/xmlenc#sha256",
        "digestValue": "BDjOg00Iiv5eQGm5adwGnW8ktSfvQ/0jYvgkYCRnryw="
    }
}